Report to Congress,,,,,,,
Number of Service-Wide Forms,,,,,,,
"By Month, Form Status, and Processing Time",,,,,,,
For the Month of July 2025,,,,,,,
Form Number,Description,Forms Received,Approvals,Denials,Pending,Pending Over 6 Months,Avg. Processing Time
I-130,Petition for Alien Relative,"81,780","84,470","12,169","2,404,876","1,942,951",14.3
I-360,"Petition for Amerasian, Widow(er), or Special Immigrant","10,914","5,784",786,"221,992","177,517",10
I-485,Application to Register Permanent Residence or Adjust Status (Asylum),"6,598","1,330",91,"92,479","56,729",16.3
I-485,Application to Register Permanent Residence or Adjust Status (Cuban),"19,354","2,265",207,"302,775","167,277",11.6
I-485,Application to Register Permanent Residence or Adjust Status (Employment),"11,991","12,520",954,"176,266","134,649",9.6
I-485,Application to Register Permanent Residence or Adjust Status (Family),"48,064","52,181","6,556","576,735","365,642",8.8
I-485,Application to Register Permanent Residence or Adjust Status (Other),"1,923","1,971",328,"54,757","46,804",22.2
I-485,Application to Register Permanent Residence or Adjust Status (Refugee),"9,261",987,64,"78,117","30,489",12.7
I-751,Petition to Remove Conditions on Residence,"13,393","10,413",222,"258,982","177,959",19.2
I-765,Application for Employment Authorization,"374,325","294,232","30,710","1,859,361","672,052",2.5
N-400,Application for Naturalization,"80,119","72,334","7,743","532,052","110,789",6.4
Notes,,,,,,,
"1) ""Forms Received"" are the number of new applications or petitions received and entered into a case-tracking system during the reporting period.",,,,,,,
"2) ""Approvals"" are the number of applications or petitions approved during the reporting period.",,,,,,,
"3) ""Denials"" are the number of applications or petitions that were denied during the reporting period.",,,,,,,
"4) ""Pending"" is the number of applications or petitions awaiting a decision as of the end of the reporting period. Some actions taken on cases are not reflected in this report such as administrative closures and transfers between offices; thus, the total pending counts cannot be calculated using data from previous reporting periods.",,,,,,,
"5) ""Pending Over Six Months"" is the number of applications pending a decision more than six months after receipt, as of the end of the reporting period.",,,,,,,
"6) ""Avg. Processing Time"" is the number of months it took for an application, petition, or request to be processed from receipt to completion; the average processing time is calculated using all applications and petitions completed in the reporting period and may differ from processing times reported on other USCIS.gov webpages. ",,,,,,,
"7) This report is produced in response to direction set forth in the Consolidated Appropriations Act, 2022, Joint Explanatory Statement (H. R. 2471 / P.L. 117-103).",,,,,,,
"8) Some applications or petitions approved, denied, or pending a decision may have been received in previous reporting periods.",,,,,,,
9) The report reflects the most up-to-date estimate available at the time the database is queried and may differ from other published reports.,,,,,,,
"10) Forms received, completed (approved and denied), and pending counts may differ from counts reported in previously published reports due to processing delays and the time at which the data are queried, system updates, and post-adjudicative outcomes.",,,,,,,
"11) For a complete list of USCIS forms and descriptions, visit https://www.uscis.gov/forms.",,,,,,,
Source:,,,,,,,
"ELIS, CLAIMS3, queried August 2025",,,,,,,
